{
  "schemaVersion": "1.0.0",
  "summaryId": "summary-0001",
  "sourceRunRef": { "objectId": "run-0002" },
  "releaseIdentity": {
    "loopId": "loop.demo.hello-file",
    "semanticVersion": "1.0.0",
    "packageContentDigest": { "algorithm": "SHA-256", "digestHex": "bd0744455f140b0c49f72b83b21489ea512354a54ae7d43bef4e0489fd31181e", "byteLength": 4096 }
  },
  "engineVersion": "1.0.0",
  "terminalState": "SUCCEEDED_VERIFIED",
  "terminalReason": { "category": "ALL_REQUIRED_VERIFIERS_PASSED", "detail": "Verifier n2 confirmed the file write against its declared fixture." },
  "nodeStateSummary": {
    "publishedLoop": true,
    "totalNodeCount": 2,
    "nodeOutcomeCounts": [
      { "outcome": "SUCCEEDED", "count": 2 }
    ],
    "nodeIds": ["n1", "n2"]
  },
  "durationSeconds": 20.5,
  "retryCount": 0,
  "aggregateCostUsd": 0.008,
  "aggregateTokens": 3200,
  "localCloudRatio": { "computed": true, "ratioVersion": "fb-ratio-1", "localFraction": 1.0, "remoteFraction": 0.0, "ciFraction": 0.0 },
  "capabilityCategories": ["workspace", "model"],
  "scanState": "SCANNED_CLEAN",
  "verificationClaim": null,
  "producedAtUtc": "2026-08-07T09:11:00Z"
}
