{
  "schemaVersion": "1.0.0",
  "summaryId": "summary-adv-0002",
  "sourceRunRef": { "objectId": "run-adv-0002" },
  "releaseIdentity": {
    "loopId": "loop.demo.hello-file",
    "semanticVersion": "1.0.0",
    "packageContentDigest": { "algorithm": "SHA-256", "digestHex": "bd0744455f140b0c49f72b83b21489ea512354a54ae7d43bef4e0489fd31181e", "byteLength": 4096 }
  },
  "engineVersion": "1.0.0",
  "terminalState": "SUCCEEDED_UNVERIFIED",
  "terminalReason": { "category": "REQUIRED_VERIFIER_INCOMPLETE", "detail": "One required verifier was skipped." },
  "nodeStateSummary": {
    "publishedLoop": true,
    "totalNodeCount": 2,
    "nodeOutcomeCounts": [
      { "outcome": "SUCCEEDED", "count": 3 },
      { "outcome": "FAILED", "count": 1 },
      { "outcome": "RETRIED", "count": 1 }
    ],
    "nodeIds": ["n1", "n2"]
  },
  "durationSeconds": 8.0,
  "retryCount": 1,
  "aggregateCostUsd": 0.002,
  "aggregateTokens": 500,
  "localCloudRatio": { "computed": true, "ratioVersion": "fb-ratio-1", "localFraction": 1.0, "remoteFraction": 0.0, "ciFraction": 0.0 },
  "capabilityCategories": ["model"],
  "scanState": "SCANNED_CLEAN",
  "verificationClaim": null,
  "producedAtUtc": "2026-08-07T09:42:00Z"
}
